{
  "id": "example-btc-trend",
  "version": "0.1.0",
  "description": "Example strategy definition demonstrating the ADR-0005 contract shape. NOT validated for trading: the validation_report below is a placeholder shape for schema testing only and refers to no real backtest.",
  "universe": { "symbols": ["BTC-USD"], "exchanges": ["paper"] },
  "signal": {
    "kind": "declarative-rules",
    "parameters": { "fast": 50, "slow": 200 },
    "entry_rules": [
      { "indicator": "sma", "window": 50, "operator": "crosses_above",
        "operand": { "indicator": "sma", "window": 200 } }
    ],
    "exit_rules": [
      { "indicator": "sma", "window": 50, "operator": "crosses_below",
        "operand": { "indicator": "sma", "window": 200 } }
    ]
  },
  "risk": {
    "max_position_pct_equity": 5,
    "stop_loss_pct": 10,
    "max_gross_exposure_pct": 50,
    "max_daily_loss_pct": 2
  },
  "data_dependencies": [
    { "series": "ohlcv", "frequency": "1d", "lookback_bars": 250 }
  ],
  "validation_report": {
    "path": "docs/validation/example-btc-trend-v0.1.0.md",
    "sha256": "0000000000000000000000000000000000000000000000000000000000000000",
    "signed_off_by": "SCHEMA-EXAMPLE-ONLY",
    "signed_off_date": "2026-07-07",
    "result": "pass"
  }
}
